{
  "required" : true ,
  "$schema" : "http://json-schema.org/draft-03/schema" ,
  "type" : "object" ,
  "properties" : {
    "id" : {
      "type" : "string" ,
      "required" : false
    } ,
    "valid_until" : {
      "type" : "string" ,
      "required" : false
    } ,
    "state" : {
      "type" : "string" ,
      "required" : false
    } ,
    "payer_id" : {
      "type" : "string" ,
      "required" : false
    } ,
    "type" : {
      "type" : "string" ,
      "required" : false
    } ,
    "number" : {
      "type" : "string" ,
      "required" : false
    } ,
    "expire_month" : {
      "type" : "string" ,
      "required" : false
    } ,
    "expire_year" : {
      "type" : "string" ,
      "required" : false
    } ,
    "first_name" : {
      "type" : "string" ,
      "required" : false
    } ,
    "last_name" : {
      "type" : "string" ,
      "required" : false
    } ,
    "links" : {
      "type" : "array" ,
      "required" : false ,
      "items" : [
        {
          "type" : "object" ,
          "properties" : {
            "href" : {
              "type" : "string" ,
              "required" : false
            } ,
            "rel" : {
              "type" : "string" ,
              "required" : false
            } ,
            "method" : {
              "type" : "string" ,
              "required" : false
            }
          }
        }
      ]
    }
  }
}